{
  "$schema": "../../../../schemas/research/r0.02/architecture-graph.schema.json",
  "data": {
    "architecture_edges": [
      {
        "data_form": "Cinema payload",
        "error_behavior": "structured diagnostics",
        "from": "N-CINEMA",
        "id": "AE-01",
        "kind": "VALIDATES",
        "semantic_disposition": "intent retained",
        "source_refs": [
          "S-CINEMA-TEST",
          "S-CINEMA-COMPILER"
        ],
        "to": "N-CINEMA-VALIDATE",
        "validation": "schema and semantic checks"
      },
      {
        "data_form": "Cinema payload",
        "error_behavior": "inspection findings",
        "from": "N-CINEMA",
        "id": "AE-02",
        "kind": "INSPECTS",
        "semantic_disposition": "roles and paths retained",
        "source_refs": [
          "S-CINEMA-INSPECT",
          "S-CINEMA-RESOLVE"
        ],
        "to": "N-INSPECT",
        "validation": "payload accepted for analysis"
      },
      {
        "data_form": "React element program",
        "error_behavior": "warnings, placeholders, or throw",
        "from": "N-CINEMA",
        "id": "AE-03",
        "kind": "LOWERS_TO",
        "semantic_disposition": "named intent partly consumed",
        "source_refs": [
          "S-CINEMA-COMPILER"
        ],
        "to": "N-REACT",
        "validation": "post-validation construction"
      },
      {
        "data_form": "React elements and frame context",
        "error_behavior": "unsupported host error",
        "from": "N-REACT",
        "id": "AE-04",
        "kind": "INVOKES",
        "semantic_disposition": "component structure evaluated",
        "source_refs": [
          "S-REACT-LOWER",
          "S-REACT-HOST"
        ],
        "to": "N-RECONCILER",
        "validation": "host element contract"
      },
      {
        "data_form": "host commits",
        "error_behavior": "commit failure",
        "from": "N-RECONCILER",
        "id": "AE-05",
        "kind": "MUTATES",
        "semantic_disposition": "React tree materialized",
        "source_refs": [
          "S-REACT-HOST"
        ],
        "to": "N-HOST",
        "validation": "host-config validation"
      },
      {
        "data_form": "finite host primitives",
        "error_behavior": "conversion error",
        "from": "N-HOST",
        "id": "AE-06",
        "kind": "LOWERS_TO",
        "semantic_disposition": "React key and component provenance dropped unless explicit",
        "source_refs": [
          "S-REACT-LOWER"
        ],
        "to": "N-SCENE",
        "validation": "toNode conversion"
      },
      {
        "data_form": "Scene plus tracks",
        "error_behavior": "missing target or property behavior",
        "from": "N-TIMELINE",
        "id": "AE-07",
        "kind": "CLONES",
        "semantic_disposition": "keyframes materialized into values",
        "source_refs": [
          "S-ANIMATION"
        ],
        "to": "N-SCENE",
        "validation": "target lookup"
      },
      {
        "data_form": "Scene or Scene array",
        "error_behavior": "serialization error",
        "from": "N-SCENE",
        "id": "AE-08",
        "kind": "SERIALIZES",
        "semantic_disposition": "renderer data preserved",
        "source_refs": [
          "S-SCENE",
          "S-NODE-EXPORT"
        ],
        "to": "N-SERIAL",
        "validation": "serde serialization"
      },
      {
        "data_form": "Scene JSON",
        "error_behavior": "parse or version error",
        "from": "N-SERIAL",
        "id": "AE-09",
        "kind": "DESERIALIZES",
        "semantic_disposition": "authoring semantics unavailable",
        "source_refs": [
          "S-CLI",
          "S-WASM"
        ],
        "to": "N-PREPASSES",
        "validation": "serde and version handling"
      },
      {
        "data_form": "Scene",
        "error_behavior": "remote fetch failure is stderr-only and nonfatal; decode/layout/SVG errors follow their boundary contracts",
        "from": "N-SCENE",
        "id": "AE-10",
        "kind": "NORMALIZES",
        "semantic_disposition": "successful URLs are remapped to temporary files; failed URLs remain for decoder skip; layout/document structure is materialized",
        "source_refs": [
          "S-EVID-CLI-MATERIALIZE",
          "S-EVID-LAYOUT-PREPASS",
          "S-EVID-IMAGE-PREPASS",
          "S-EVID-SVG-PREPASS"
        ],
        "to": "N-PREPASSES",
        "validation": "best-effort remote GET to temporary file, then media/layout/SVG resolution"
      },
      {
        "data_form": "resolved Scene",
        "error_behavior": "renderer failure",
        "from": "N-PREPASSES",
        "id": "AE-11",
        "kind": "EMITS",
        "semantic_disposition": "supported visual semantics rasterized",
        "source_refs": [
          "S-WASM",
          "S-CLI"
        ],
        "to": "N-CPU",
        "validation": "CPU capability checks"
      },
      {
        "data_form": "resolved Scene",
        "error_behavior": "GPU failure",
        "from": "N-PREPASSES",
        "id": "AE-12",
        "kind": "EMITS",
        "semantic_disposition": "supported visual semantics rasterized",
        "source_refs": [
          "S-WASM-VELLO",
          "S-CLI"
        ],
        "to": "N-GPU",
        "validation": "GPU capability checks"
      },
      {
        "data_form": "resolved Scene",
        "error_behavior": "diagnosed or runtime fallback",
        "from": "N-GPU",
        "id": "AE-13",
        "kind": "FALLS_BACK_TO",
        "semantic_disposition": "GPU-only fidelity may reduce",
        "source_refs": [
          "S-PLAYER",
          "S-MANDATORY-PACKAGES-PLAYER-SRC-ENGINE-DRAWER-TS"
        ],
        "to": "N-CPU",
        "validation": "runtime capability/failure"
      },
      {
        "data_form": "Scene subset",
        "error_behavior": "preview fallback",
        "from": "N-CPU",
        "id": "AE-14",
        "kind": "FALLS_BACK_TO",
        "semantic_disposition": "unsupported features approximated or omitted",
        "source_refs": [
          "S-CANVAS",
          "S-PLAYER"
        ],
        "to": "N-CANVAS",
        "validation": "Canvas support checks"
      },
      {
        "data_form": "Scene subset",
        "error_behavior": "unsupported node handling",
        "from": "N-SCENE",
        "id": "AE-15",
        "kind": "APPROXIMATES_AS",
        "semantic_disposition": "finite subset rendered approximately",
        "source_refs": [
          "S-CANVAS"
        ],
        "to": "N-CANVAS",
        "validation": "Canvas dispatch"
      },
      {
        "data_form": "requested output frame",
        "error_behavior": "playback diagnostic",
        "from": "N-PLAYER",
        "id": "AE-16",
        "kind": "OWNS_TIME",
        "semantic_disposition": "frame choice only",
        "source_refs": [
          "S-PLAYER"
        ],
        "to": "N-REACT",
        "validation": "playback range and rate"
      },
      {
        "data_form": "ordered pixel frames",
        "error_behavior": "CLI/encoder failure",
        "from": "N-CPU",
        "id": "AE-17",
        "kind": "EMITS",
        "semantic_disposition": "scene semantics become timestamps and pixels",
        "source_refs": [
          "S-CLI"
        ],
        "to": "N-ENCODER",
        "validation": "encoder contract"
      },
      {
        "data_form": "ordered pixel frames",
        "error_behavior": "CLI/encoder failure",
        "from": "N-GPU",
        "id": "AE-18",
        "kind": "EMITS",
        "semantic_disposition": "scene semantics become timestamps and pixels",
        "source_refs": [
          "S-CLI"
        ],
        "to": "N-ENCODER",
        "validation": "encoder contract"
      }
    ],
    "architecture_nodes": [
      {
        "authority": "PRESENTATION_ONLY",
        "id": "N-CANVAS",
        "identity_behavior": "DOM/canvas identity is preview-only",
        "input_types": [
          "Scene subset"
        ],
        "kind": "FALLBACK",
        "mutability": "INSTANCE_MUTABLE",
        "name": "Canvas2D approximation",
        "output_types": [
          "approximate pixels"
        ],
        "source_refs": [
          "S-CANVAS"
        ],
        "time_domains": [
          "FRAME_INDEX_INTEGER"
        ]
      },
      {
        "authority": "AUTHORITATIVE",
        "id": "N-CINEMA",
        "identity_behavior": "string IDs retained during Cinema lowering",
        "input_types": [
          "Cinema payload"
        ],
        "kind": "AUTHORING_SURFACE",
        "mutability": "IMMUTABLE_DATA",
        "name": "Cinema payload",
        "output_types": [
          "React elements"
        ],
        "source_refs": [
          "S-CINEMA-TYPES",
          "S-CINEMA-COMPILER"
        ],
        "time_domains": [
          "SECONDS_NUMBER",
          "COMPOSITION_FRAME_LOCAL"
        ]
      },
      {
        "authority": "DERIVED",
        "id": "N-CINEMA-VALIDATE",
        "identity_behavior": "reports payload paths",
        "input_types": [
          "Cinema payload"
        ],
        "kind": "VALIDATOR",
        "mutability": "IMMUTABLE_DATA",
        "name": "Cinema validator",
        "output_types": [
          "diagnostics"
        ],
        "source_refs": [
          "S-CINEMA-TEST",
          "S-CINEMA-COMPILER"
        ],
        "time_domains": [
          "NONE"
        ]
      },
      {
        "authority": "DERIVED",
        "id": "N-CPU",
        "identity_behavior": "renderer-bound identity only",
        "input_types": [
          "resolved Scene"
        ],
        "kind": "RENDERER_BOUNDARY",
        "mutability": "INSTANCE_MUTABLE",
        "name": "CPU renderer",
        "output_types": [
          "pixels"
        ],
        "source_refs": [
          "S-WASM",
          "S-CLI"
        ],
        "time_domains": [
          "FRAME_INDEX_FLOAT"
        ]
      },
      {
        "authority": "EXTERNAL_RUNTIME",
        "id": "N-ENCODER",